case_num,config_id,query_id,query,retrieved_doc_ids,answer,composite,context_recall,answer_similarity,faithfulness,retrieval_coverage_proxy,groundedness,citation_quality,answer_relevancy,context_relevancy,signal_quality,composite_no_judge,judge_weight,failure_reason,ragchecker_findings,hallucination_risk,retrieval_bias,query_drift,judge_score,judge_method,judge_warning,retrieval_failure_type,grounding_failure_type,citation_failure_type,query_processing_failure_type,citation_completeness,citation_binding,query_program_final_queries,query_program_execution_path,query_program_depth,query_rewrite_usage,decompose_branch_count,hyde_usage,metadata_filter_hit_rate,metadata_bonus_avg,entity_match_rate,rrf_fusion_gain
1,cfg_00044,C1Q002,When can a transaction monitoring alert be escalated?,D005|D010|D001|D004|D009|D007,"A transaction monitoring alert can be escalated when pattern scores exceed threshold, when sanctions-related entities are detected, or when structuring behavior is observed across linked accounts. [D005] [D005]",0.5692,0.5225,0.9435,0.4932,,,,0.301,0.0706,1.0,0.5749,0.01,生成存在幻觉风险,citation=duplicate_citation,low,False,False,0.0,llm_judge_ollama,,none,none,duplicate_citation,none,2.0,1.0,When can a transaction monitoring alert be escalated?,QueryExpand > IntentFilter,2,0,0,0,0.0,0.0,0.0,0.0
1,cfg_00044,C1Q003,How can a RAG system improve retrieval quality?,D008|D010|D004|D005|D001|D002,"A RAG system can improve retrieval quality by tuning chunk size, overlap, metadata enrichment, hybrid retrieval, reranking, and query rewriting before generation. [D008]

When no reference answer exists, evaluation should emphasize retrieval coverage, citation quality, answer groundedness, and model-based pairwise judgment with human spot checks. [D010]",0.6233,0.5828,0.8974,0.6019,,,,0.1838,0.0482,1.0,0.6296,0.01,通过,no_major_issue,low,False,False,0.0,llm_judge_ollama,,none,none,none,none,1.0,1.0,How can a RAG system improve retrieval quality?,QueryExpand > IntentFilter,2,0,0,0,0.0,0.0,0.0,0.0
1,cfg_00044,C1Q005,How should evaluation change when no reference answer exists?,D010|D009|D005|D001|D002|D003,"When no reference answer exists, evaluation should emphasize retrieval coverage, citation quality, answer groundedness, and model-based pairwise judgment with human spot checks. [D010] In evaluation datasets, the relevant context should be compared with retrieved passages. Final answers should be compared with reference answers using exact match and semantic similarity where appropriate. [D009] A transaction monitoring alert may be escalated when pattern scores exceed threshold, when sanctions-related entities are detected, or when structuring behavior is observed across linked accounts. [D005] A retail bank CRM assistant should use the latest source of truth from product policy documents and fee schedules. Personal data fields must be masked before external model calls. [D001] Mortgage prepayment penalties depend on product type, fixed-rate period, and local regulation. Waivers may apply for hardship cases approved by credit risk. [D002] For Singapore savings accounts, fall-below fees depend on average daily balance and customer segment. Some premium segments are exempt. [D003]",0.7526,0.5915,0.8694,0.9817,,,,0.0939,0.0728,1.0,0.7602,0.01,通过,query_proc=query_drift,low,False,True,0.0,llm_judge_ollama,,none,none,none,query_drift,0.75,1.0,How should evaluation change when no reference answer exists?,QueryExpand > IntentFilter,2,0,0,0,0.0,0.0,0.0,0.0
1,cfg_00044,C1Q001,What is the KYC refresh interval for a standard-risk retail customer?,D004|D001|D007|D005|D009|D003,"The KYC refresh interval for a standard-risk retail customer is every 36 months, unless a trigger event occurs earlier. [D004]",0.5772,0.585,0.9124,0.4388,,,,0.5118,0.0846,1.0,0.583,0.01,生成存在幻觉风险,query_proc=under_decomposition,low,False,False,0.0,llm_judge_ollama,,none,none,none,under_decomposition,1.0,1.0,What is the KYC refresh interval for a standard-risk retail customer? || What is the KYC refresh interval for a standard-risk retail customer? know your customer identity verification,QueryExpand > IntentFilter,2,1,0,0,0.0,0.0133,0.1667,0.0
2,cfg_00012,C2Q002,What signals tend to matter for SME credit assessment?,D006|D002|D007|D004|D003|D001,"Based on the provided context, signals that tend to matter for SME credit assessment include:

- **Bureau signals**: [D006] SME lending decisions typically combine bureau signals.
- **Cashflow trends**: [D006] SME lending decisions typically combine cashflow trends.
- **Collateral coverage**: [D006] SME lending decisions typically combine collateral coverage.
- **Sector outlook**: [D006] SME lending decisions typically combine sector outlook.
- **Recent delinquency**: [D006] Recent delinquency often materially increases risk.

These signals are integral to assessing the creditworthiness of Small and Medium Enterprises (SMEs).",0.2936,,,,0.6,0.4922,0.1667,0.1852,0.0383,0.6667,0.2885,0.01,答案与证据绑定不足,citation=duplicate_citation,low,False,False,0.8,llm_judge_ollama,,none,none,duplicate_citation,none,0.8333,1.0,What signals tend to matter for SME credit assessment? || What signals tend to matter for SME credit assessment? loan lending creditworthiness,QueryExpand > QueryDecompose > IntentFilter,3,1,0,0,0.0,0.0,0.0,0.0
2,cfg_00012,C2Q003,What should a bank check before issuing provisional credit for a card dispute?,D007|D001|D006|D004|D002|D005,"To issue provisional credit for a card dispute, a bank should check the following before intake:

[D007] - required evidence is received and fraud indicators are not contradictory.

Therefore, the bank should ensure that required evidence is received and that there are no fraud indicators that contradict each other before issuing provisional credit. This ensures that the credit issuance complies with the policy of requiring necessary evidence and avoiding issuing provisional credit if there are any contradictions in fraud indicators.",0.2739,,,,0.5,0.4518,0.1667,0.2339,0.0521,0.6667,0.2767,0.01,答案与证据绑定不足,grounding=unsupported_claims,medium,False,False,0.0,llm_judge_ollama,,none,unsupported_claims,none,none,0.3333,1.0,What should a bank check before issuing provisional credit for a card dispute? || What should a bank check before issuing provisional credit for a card dispute? loan lending creditworthiness,QueryExpand > QueryDecompose > IntentFilter,3,1,0,0,0.0,0.0267,0.3333,0.0
2,cfg_00012,C2Q005,What controls are important before sending CRM data to an external model?,D001|D008|D003|D005|D007|D002,"Before sending CRM data to an external model, important controls include masking personal data fields [D001], and using the latest source of truth from product policy documents and fee schedules [D001]. Additionally, for Singapore savings accounts, fall-below fees depend on average daily balance and customer segment, with some premium segments being exempt [D003]. For card disputes, provisional credit may be issued after intake if required evidence is received and fraud indicators are not contradictory [D007]. RAG systems can improve retrieval quality by tuning chunk size, overlap, metadata enrichment, hybrid retrieval, reranking, and query rewriting before generation [D008]. Transaction monitoring alerts may be escalated when pattern scores exceed threshold, when sanctions-related entities are detected, or when structuring behavior is observed across",0.3516,,,,0.8,0.7895,0.0,0.1293,0.0363,0.6,0.3552,0.01,通过,citation=missing_citation | query_proc=query_drift,low,False,True,0.0,llm_judge_ollama,,none,none,missing_citation,query_drift,0.0,0.0,What controls are important before sending CRM data to an external model?,QueryExpand > QueryDecompose > IntentFilter,3,0,0,0,0.0,0.0,0.0,0.0
2,cfg_00012,C2Q001,What are the main fee-exemption conditions for Singapore savings accounts?,D003|D009|D001|D007|D005|D004,"Based on the provided context, there is no specific information about fee-exemption conditions for Singapore savings accounts. The context mentions that fall-below fees depend on average daily balance and customer segment, but it does not provide details on which segments are exempt from fees. Therefore, there is insufficient evidence to explicitly cite a document ID for the main fee-exemption conditions for Singapore savings accounts. [D003]",0.3312,,,,0.8,0.4729,0.1667,0.2745,0.0624,0.6667,0.3345,0.01,答案与证据绑定不足,grounding=unsupported_claims,medium,False,False,0.0,llm_judge_ollama,,none,unsupported_claims,none,none,0.3333,1.0,What are the main fee-exemption conditions for Singapore savings accounts?,QueryExpand > QueryDecompose > IntentFilter,3,0,0,0,0.0,0.0,0.0,0.0
